Microsoft Windows [Version 10.0.22631.3447]
(c) Microsoft Corporation. All rights reserved.

C:\Program Files\MySQL\MySQL Server 8.0\bin>mysql -u root -p
Enter password: **************
Welcome to the MySQL monitor.  Commands end with ; or \g.
Your MySQL connection id is 24
Server version: 8.0.36 MySQL Community Server - GPL

Copyright (c) 2000, 2024, Oracle and/or its affiliates.

Oracle is a registered trademark of Oracle Corporation and/or its
affiliates. Other names may be trademarks of their respective
owners.

Type 'help;' or '\h' for help. Type '\c' to clear the current input statement.

mysql> show databases;
+--------------------+
| Database           |
+--------------------+
| information_schema |
| mysql              |
| nalan              |
| online_shooping    |
| performance_schema |
| sms_db             |
| sys                |
+--------------------+
7 rows in set (0.00 sec)

mysql> use nalan;
Database changed
mysql> select * from employee;
ERROR 1146 (42S02): Table 'nalan.employee' doesn't exist
mysql> select * from tbl_employee;
+-------+---------+---------+--------+---------+------+
| empid | ename   | emobile | ebatch | egender | role |
+-------+---------+---------+--------+---------+------+
| 12005 | Malini  | 789045  | 2      | F       | SD   |
| 12140 | bala    | 984523  | 3      | M       | SD   |
| 12206 | vickee  | 984503  | 5      | M       | SD   |
| 12219 | Aravind | 861061  | 5      | M       | SD   |
+-------+---------+---------+--------+---------+------+
4 rows in set (0.00 sec)

mysql> select count(*) from tbl_employee;
+----------+
| count(*) |
+----------+
|        4 |
+----------+
1 row in set (0.00 sec)

mysql> select egender,count(*) from tbl_employee group by egender;
+---------+----------+
| egender | count(*) |
+---------+----------+
| F       |        1 |
| M       |        3 |
+---------+----------+
2 rows in set (0.00 sec)

mysql> select egender,count(*) from tbl_employee group by egender having egender="M";
+---------+----------+
| egender | count(*) |
+---------+----------+
| M       |        3 |
+---------+----------+
1 row in set (0.01 sec)

mysql> select max(empid) from tbl_employee;
+------------+
| max(empid) |
+------------+
|      12219 |
+------------+
1 row in set (0.01 sec)

mysql> select min(empid) from tbl_employee;
+------------+
| min(empid) |
+------------+
|      12005 |
+------------+
1 row in set (0.00 sec)

mysql> select avg(empid) from tbl_employee;
+------------+
| avg(empid) |
+------------+
| 12142.5000 |
+------------+
1 row in set (0.01 sec)

mysql> select distinct(ebatch) from tbl_employee;
+--------+
| ebatch |
+--------+
| 2      |
| 3      |
| 5      |
+--------+
3 rows in set (0.00 sec)

mysql> select distinct(egender) from tbl_employee;
+---------+
| egender |
+---------+
| F       |
| M       |
+---------+
2 rows in set (0.00 sec)

mysql> select top 2 from tbl_employee;
ERROR 1064 (42000): You have an error in your SQL syntax; check the manual that corresponds to your MySQL server version for the right syntax to use near '2 from tbl_employee' at line 1
mysql> select sum(ebatch) from tbl_employee;
+-------------+
| sum(ebatch) |
+-------------+
|          15 |
+-------------+
1 row in set (0.00 sec)

mysql> select top 2 * from tbl_employee;
ERROR 1064 (42000): You have an error in your SQL syntax; check the manual that corresponds to your MySQL server version for the right syntax to use near '2 * from tbl_employee' at line 1
mysql> select top * from tbl_employee;
ERROR 1064 (42000): You have an error in your SQL syntax; check the manual that corresponds to your MySQL server version for the right syntax to use near 'from tbl_employee' at line 1
mysql> select Top 2 * from tbl_employee;
ERROR 1064 (42000): You have an error in your SQL syntax; check the manual that corresponds to your MySQL server version for the right syntax to use near '2 * from tbl_employee' at line 1
mysql> show tables;
+-----------------+
| Tables_in_nalan |
+-----------------+
| tbl_approver    |
| tbl_employee    |
| tbl_leave       |
+-----------------+
3 rows in set (0.00 sec)

mysql> select * from tbl_employee;
+-------+---------+---------+--------+---------+------+
| empid | ename   | emobile | ebatch | egender | role |
+-------+---------+---------+--------+---------+------+
| 12005 | Malini  | 789045  | 2      | F       | SD   |
| 12140 | bala    | 984523  | 3      | M       | SD   |
| 12206 | vickee  | 984503  | 5      | M       | SD   |
| 12219 | Aravind | 861061  | 5      | M       | SD   |
+-------+---------+---------+--------+---------+------+
4 rows in set (0.00 sec)

mysql> select * from tbl_approver;
+-----+--------------+-------+
| aid | status       | empid |
+-----+--------------+-------+
|   1 | Approved     | 12219 |
|   2 | Not Approved | 12005 |
|   3 | requested    | 12140 |
|   4 | Rejected     | 12206 |
+-----+--------------+-------+
4 rows in set (0.00 sec)

mysql> select * from tbl_leave;
+------+---------------+-----+
| aid  | type_of_leave | lid |
+------+---------------+-----+
|    1 | CL            | 1A  |
|    2 | PL            | 2A  |
|    3 | OD            | 3A  |
|    4 | LOP           | 4A  |
+------+---------------+-----+
4 rows in set (0.00 sec)

mysql> select * from tbl_employee where empid <= ( select min(empid) from tbl_employee);
+-------+--------+---------+--------+---------+------+
| empid | ename  | emobile | ebatch | egender | role |
+-------+--------+---------+--------+---------+------+
| 12005 | Malini | 789045  | 2      | F       | SD   |
+-------+--------+---------+--------+---------+------+
1 row in set (0.00 sec)

mysql> select * from tbl_employee where empid >= ( select min(empid) from tbl_employee);
+-------+---------+---------+--------+---------+------+
| empid | ename   | emobile | ebatch | egender | role |
+-------+---------+---------+--------+---------+------+
| 12005 | Malini  | 789045  | 2      | F       | SD   |
| 12140 | bala    | 984523  | 3      | M       | SD   |
| 12206 | vickee  | 984503  | 5      | M       | SD   |
| 12219 | Aravind | 861061  | 5      | M       | SD   |
+-------+---------+---------+--------+---------+------+
4 rows in set (0.00 sec)

mysql> select * from tbl_leave where empid in ( select distinct(ebatch) from tbl_employee);
ERROR 1054 (42S22): Unknown column 'empid' in 'IN/ALL/ANY subquery'
mysql> select * from tbl_approver where empid in ( select distinct(ebatch) from tbl_employee);
Empty set (0.01 sec)

mysql> select * from tbl_employee where empid in ( select distinct(ebatch) from tbl_employee);
Empty set (0.00 sec)

mysql> create view emp_view as select * from tbl_employee;
Query OK, 0 rows affected (0.02 sec)

mysql> select * from emp_view;
+-------+---------+---------+--------+---------+------+
| empid | ename   | emobile | ebatch | egender | role |
+-------+---------+---------+--------+---------+------+
| 12005 | Malini  | 789045  | 2      | F       | SD   |
| 12140 | bala    | 984523  | 3      | M       | SD   |
| 12206 | vickee  | 984503  | 5      | M       | SD   |
| 12219 | Aravind | 861061  | 5      | M       | SD   |
+-------+---------+---------+--------+---------+------+
4 rows in set (0.01 sec)

mysql> update emp_view set enmae="Aravind Rajan" where empid=12219;
ERROR 1054 (42S22): Unknown column 'enmae' in 'field list'
mysql> update emp_view set ename="Aravind Rajan" where empid=12219;
Query OK, 1 row affected (0.01 sec)
Rows matched: 1  Changed: 1  Warnings: 0

mysql> select * from emp_view;
+-------+---------------+---------+--------+---------+------+
| empid | ename         | emobile | ebatch | egender | role |
+-------+---------------+---------+--------+---------+------+
| 12005 | Malini        | 789045  | 2      | F       | SD   |
| 12140 | bala          | 984523  | 3      | M       | SD   |
| 12206 | vickee        | 984503  | 5      | M       | SD   |
| 12219 | Aravind Rajan | 861061  | 5      | M       | SD   |
+-------+---------------+---------+--------+---------+------+
4 rows in set (0.00 sec)

mysql> select * from tbl_employee;
+-------+---------------+---------+--------+---------+------+
| empid | ename         | emobile | ebatch | egender | role |
+-------+---------------+---------+--------+---------+------+
| 12005 | Malini        | 789045  | 2      | F       | SD   |
| 12140 | bala          | 984523  | 3      | M       | SD   |
| 12206 | vickee        | 984503  | 5      | M       | SD   |
| 12219 | Aravind Rajan | 861061  | 5      | M       | SD   |
+-------+---------------+---------+--------+---------+------+
4 rows in set (0.00 sec)

mysql> insert into tbl_employee values(12217,"Ani",89099903,5,"F","SD");
Query OK, 1 row affected (0.01 sec)

mysql> update emp_view set role="frontend" where ename="vickee";
Query OK, 1 row affected (0.01 sec)
Rows matched: 1  Changed: 1  Warnings: 0

mysql> select * from emp_view;
+-------+---------------+----------+--------+---------+----------+
| empid | ename         | emobile  | ebatch | egender | role     |
+-------+---------------+----------+--------+---------+----------+
| 12005 | Malini        | 789045   | 2      | F       | SD       |
| 12140 | bala          | 984523   | 3      | M       | SD       |
| 12206 | vickee        | 984503   | 5      | M       | frontend |
| 12217 | Ani           | 89099903 | 5      | F       | SD       |
| 12219 | Aravind Rajan | 861061   | 5      | M       | SD       |
+-------+---------------+----------+--------+---------+----------+
5 rows in set (0.00 sec)

mysql> delete from emp_view where ename="bala";
ERROR 1451 (23000): Cannot delete or update a parent row: a foreign key constraint fails (`nalan`.`tbl_approver`, CONSTRAINT `tbl_approver_ibfk_1` FOREIGN KEY (`empid`) REFERENCES `tbl_employee` (`empid`))
mysql> delete from emp_view where ename='bala';
ERROR 1451 (23000): Cannot delete or update a parent row: a foreign key constraint fails (`nalan`.`tbl_approver`, CONSTRAINT `tbl_approver_ibfk_1` FOREIGN KEY (`empid`) REFERENCES `tbl_employee` (`empid`))
mysql> delete from emp_view where empid=12206;
ERROR 1451 (23000): Cannot delete or update a parent row: a foreign key constraint fails (`nalan`.`tbl_approver`, CONSTRAINT `tbl_approver_ibfk_1` FOREIGN KEY (`empid`) REFERENCES `tbl_employee` (`empid`))
mysql> delete from emp_view where empid=12005;
ERROR 1451 (23000): Cannot delete or update a parent row: a foreign key constraint fails (`nalan`.`tbl_approver`, CONSTRAINT `tbl_approver_ibfk_1` FOREIGN KEY (`empid`) REFERENCES `tbl_employee` (`empid`))
mysql> delete from tbl_approver where empname="bala";
ERROR 1054 (42S22): Unknown column 'empname' in 'where clause'
mysql> delete from tbl_approver where ename="bala";
ERROR 1054 (42S22): Unknown column 'ename' in 'where clause'
mysql> delete from tbl_approver where eid=12140;
ERROR 1054 (42S22): Unknown column 'eid' in 'where clause'
mysql> delete from tbl_approver where empid=12140;
ERROR 1451 (23000): Cannot delete or update a parent row: a foreign key constraint fails (`nalan`.`tbl_leave`, CONSTRAINT `tbl_leave_ibfk_1` FOREIGN KEY (`aid`) REFERENCES `tbl_approver` (`aid`))
mysql> delete from tbl_leave where aid=1;
Query OK, 1 row affected (0.01 sec)

mysql> delete from tbl_approver where empid=12140;
ERROR 1451 (23000): Cannot delete or update a parent row: a foreign key constraint fails (`nalan`.`tbl_leave`, CONSTRAINT `tbl_leave_ibfk_1` FOREIGN KEY (`aid`) REFERENCES `tbl_approver` (`aid`))
mysql> delete from tbl_approver where empid=12219;
Query OK, 1 row affected (0.01 sec)

mysql> select * from emp_view;
+-------+---------------+----------+--------+---------+----------+
| empid | ename         | emobile  | ebatch | egender | role     |
+-------+---------------+----------+--------+---------+----------+
| 12005 | Malini        | 789045   | 2      | F       | SD       |
| 12140 | bala          | 984523   | 3      | M       | SD       |
| 12206 | vickee        | 984503   | 5      | M       | frontend |
| 12217 | Ani           | 89099903 | 5      | F       | SD       |
| 12219 | Aravind Rajan | 861061   | 5      | M       | SD       |
+-------+---------------+----------+--------+---------+----------+
5 rows in set (0.00 sec)

mysql> delete from emp_view where ebatch=5;
ERROR 1451 (23000): Cannot delete or update a parent row: a foreign key constraint fails (`nalan`.`tbl_approver`, CONSTRAINT `tbl_approver_ibfk_1` FOREIGN KEY (`empid`) REFERENCES `tbl_employee` (`empid`))
mysql> delete from emp_view where empid=12219;
Query OK, 1 row affected (0.01 sec)

mysql> select * from emp_view;
+-------+--------+----------+--------+---------+----------+
| empid | ename  | emobile  | ebatch | egender | role     |
+-------+--------+----------+--------+---------+----------+
| 12005 | Malini | 789045   | 2      | F       | SD       |
| 12140 | bala   | 984523   | 3      | M       | SD       |
| 12206 | vickee | 984503   | 5      | M       | frontend |
| 12217 | Ani    | 89099903 | 5      | F       | SD       |
+-------+--------+----------+--------+---------+----------+
4 rows in set (0.00 sec)

mysql> select * from tbl_eemployee;
ERROR 1146 (42S02): Table 'nalan.tbl_eemployee' doesn't exist
mysql> select * from tbl_employee;
+-------+--------+----------+--------+---------+----------+
| empid | ename  | emobile  | ebatch | egender | role     |
+-------+--------+----------+--------+---------+----------+
| 12005 | Malini | 789045   | 2      | F       | SD       |
| 12140 | bala   | 984523   | 3      | M       | SD       |
| 12206 | vickee | 984503   | 5      | M       | frontend |
| 12217 | Ani    | 89099903 | 5      | F       | SD       |
+-------+--------+----------+--------+---------+----------+
4 rows in set (0.00 sec)

mysql>
